{"message_id":"append-b","thread_id":"append-thread-b","message_type":"QUESTION","timestamp":"2026-10-06T01:00:00Z","sender_role":"role-a","receiver_roles":["role-b"],"project_id":"p","candidate_revision":"c1","trigger":"test","self_audit":["fixture"],"question_or_answer":"Question B?","competing_explanations":["x","y"],"requested_evidence_or_action":"answer B","evidence":["fixture"],"affected_claims":["claim-B"],"affected_gates":["GATE-B"],"data_role_impact":"none","response_condition":"test","status":"OPEN"}
