{"message_id":"append-a","thread_id":"append-thread-a","message_type":"QUESTION","timestamp":"2026-10-06T01:00:00Z","sender_role":"role-a","receiver_roles":["role-b"],"project_id":"p","candidate_revision":"c1","trigger":"test","self_audit":["fixture"],"question_or_answer":"Question A?","competing_explanations":["x","y"],"requested_evidence_or_action":"answer A","evidence":["fixture"],"affected_claims":["claim-A"],"affected_gates":["GATE-A"],"data_role_impact":"none","response_condition":"test","status":"OPEN"}
