{"message_id":"append-unknown","thread_id":"append-thread-a","predecessor_message_id":"does-not-exist","message_type":"RESPONSE","timestamp":"2026-10-06T01:01:00Z","sender_role":"role-b","receiver_roles":["role-a"],"project_id":"p","candidate_revision":"c1","trigger":"test","self_audit":["fixture"],"question_or_answer":"Answer.","evidence":["fixture"],"affected_claims":["claim-A"],"affected_gates":["GATE-A"],"data_role_impact":"none","status":"ANSWERED"}
